[
  {
    "id": "q1-unreal-l01",
    "scheduleId": "q1-unreal-l01",
    "programAreaId": "unreal-engine",
    "quarter": "Q1",
    "lessonId": "ue-q1-l01",
    "lessonNumber": 1,
    "lessonTitle": "Creating Your First Unreal Project",
    "aDayDate": "2026-08-17",
    "bDayDate": "2026-08-18",
    "aDayCycle": "A",
    "bDayCycle": "B",
    "aDayCalendarNote": "Q1 Unreal A/B lesson schedule starts here.",
    "bDayCalendarNote": "",
    "activeItemType": "lesson",
    "status": "scheduled",
    "source": "attached-school-calendar",
    "notes": ""
  },
  {
    "id": "q1-unreal-l02",
    "scheduleId": "q1-unreal-l02",
    "programAreaId": "unreal-engine",
    "quarter": "Q1",
    "lessonId": "ue-q1-l02",
    "lessonNumber": 2,
    "lessonTitle": "Unreal Interface Tour",
    "aDayDate": "2026-08-19",
    "bDayDate": "2026-08-20",
    "aDayCycle": "A",
    "bDayCycle": "B",
    "aDayCalendarNote": "",
    "bDayCalendarNote": "",
    "activeItemType": "lesson",
    "status": "scheduled",
    "source": "attached-school-calendar",
    "notes": ""
  },
  {
    "id": "q1-unreal-l03",
    "scheduleId": "q1-unreal-l03",
    "programAreaId": "unreal-engine",
    "quarter": "Q1",
    "lessonId": "ue-q1-l03",
    "lessonNumber": 3,
    "lessonTitle": "Viewport Navigation",
    "aDayDate": "2026-08-21",
    "bDayDate": "2026-08-24",
    "aDayCycle": "A",
    "bDayCycle": "B",
    "aDayCalendarNote": "",
    "bDayCalendarNote": "",
    "activeItemType": "lesson",
    "status": "scheduled",
    "source": "attached-school-calendar",
    "notes": ""
  },
  {
    "id": "q1-unreal-l04",
    "scheduleId": "q1-unreal-l04",
    "programAreaId": "unreal-engine",
    "quarter": "Q1",
    "lessonId": "ue-q1-l04",
    "lessonNumber": 4,
    "lessonTitle": "Moving, Rotating, and Scaling Objects",
    "aDayDate": "2026-08-25",
    "bDayDate": "2026-08-26",
    "aDayCycle": "A",
    "bDayCycle": "B",
    "aDayCalendarNote": "",
    "bDayCalendarNote": "",
    "activeItemType": "lesson",
    "status": "scheduled",
    "source": "attached-school-calendar",
    "notes": ""
  },
  {
    "id": "q1-unreal-l05",
    "scheduleId": "q1-unreal-l05",
    "programAreaId": "unreal-engine",
    "quarter": "Q1",
    "lessonId": "ue-q1-l05",
    "lessonNumber": 5,
    "lessonTitle": "Quiz 1 and First Scene Cleanup",
    "aDayDate": "2026-08-31",
    "bDayDate": "2026-08-28",
    "aDayCycle": "A",
    "bDayCycle": "B",
    "aDayCalendarNote": "",
    "bDayCalendarNote": "",
    "activeItemType": "lesson",
    "status": "scheduled",
    "source": "attached-school-calendar",
    "notes": ""
  },
  {
    "id": "q1-unreal-l06",
    "scheduleId": "q1-unreal-l06",
    "programAreaId": "unreal-engine",
    "quarter": "Q1",
    "lessonId": "ue-q1-l06",
    "lessonNumber": 6,
    "lessonTitle": "Exposure and Post-Process",
    "aDayDate": "2026-09-02",
    "bDayDate": "2026-09-01",
    "aDayCycle": "A",
    "bDayCycle": "B",
    "aDayCalendarNote": "",
    "bDayCalendarNote": "",
    "activeItemType": "lesson",
    "status": "scheduled",
    "source": "attached-school-calendar",
    "notes": ""
  },
  {
    "id": "q1-unreal-l07",
    "scheduleId": "q1-unreal-l07",
    "programAreaId": "unreal-engine",
    "quarter": "Q1",
    "lessonId": "ue-q1-l07",
    "lessonNumber": 7,
    "lessonTitle": "Materials Basics",
    "aDayDate": "2026-09-08",
    "bDayDate": "2026-09-03",
    "aDayCycle": "A",
    "bDayCycle": "B",
    "aDayCalendarNote": "",
    "bDayCalendarNote": "",
    "activeItemType": "lesson",
    "status": "scheduled",
    "source": "attached-school-calendar",
    "notes": ""
  },
  {
    "id": "q1-unreal-l08",
    "scheduleId": "q1-unreal-l08",
    "programAreaId": "unreal-engine",
    "quarter": "Q1",
    "lessonId": "ue-q1-l08",
    "lessonNumber": 8,
    "lessonTitle": "Texture Maps and Normal Maps",
    "aDayDate": "2026-09-10",
    "bDayDate": "2026-09-09",
    "aDayCycle": "A",
    "bDayCycle": "B",
    "aDayCalendarNote": "",
    "bDayCalendarNote": "",
    "activeItemType": "lesson",
    "status": "scheduled",
    "source": "attached-school-calendar",
    "notes": ""
  },
  {
    "id": "q1-unreal-l09",
    "scheduleId": "q1-unreal-l09",
    "programAreaId": "unreal-engine",
    "quarter": "Q1",
    "lessonId": "ue-q1-l09",
    "lessonNumber": 9,
    "lessonTitle": "Quiz 2 and Material Instances",
    "aDayDate": "2026-09-14",
    "bDayDate": "2026-09-11",
    "aDayCycle": "A",
    "bDayCycle": "B",
    "aDayCalendarNote": "",
    "bDayCalendarNote": "",
    "activeItemType": "lesson",
    "status": "scheduled",
    "source": "attached-school-calendar",
    "notes": ""
  },
  {
    "id": "q1-unreal-l10",
    "scheduleId": "q1-unreal-l10",
    "programAreaId": "unreal-engine",
    "quarter": "Q1",
    "lessonId": "ue-q1-l10",
    "lessonNumber": 10,
    "lessonTitle": "Master Materials",
    "aDayDate": "2026-09-16",
    "bDayDate": "2026-09-15",
    "aDayCycle": "A",
    "bDayCycle": "B",
    "aDayCalendarNote": "",
    "bDayCalendarNote": "",
    "activeItemType": "lesson",
    "status": "scheduled",
    "source": "attached-school-calendar",
    "notes": ""
  },
  {
    "id": "q1-unreal-l11",
    "scheduleId": "q1-unreal-l11",
    "programAreaId": "unreal-engine",
    "quarter": "Q1",
    "lessonId": "ue-q1-l11",
    "lessonNumber": 11,
    "lessonTitle": "Importing Static Meshes",
    "aDayDate": "2026-09-18",
    "bDayDate": "2026-09-17",
    "aDayCycle": "A",
    "bDayCycle": "B",
    "aDayCalendarNote": "",
    "bDayCalendarNote": "",
    "activeItemType": "lesson",
    "status": "scheduled",
    "source": "attached-school-calendar",
    "notes": ""
  },
  {
    "id": "q1-unreal-l12",
    "scheduleId": "q1-unreal-l12",
    "programAreaId": "unreal-engine",
    "quarter": "Q1",
    "lessonId": "ue-q1-l12",
    "lessonNumber": 12,
    "lessonTitle": "Migrating Assets Between Projects",
    "aDayDate": "2026-09-23",
    "bDayDate": "2026-09-22",
    "aDayCycle": "A",
    "bDayCycle": "B",
    "aDayCalendarNote": "",
    "bDayCalendarNote": "",
    "activeItemType": "lesson",
    "status": "scheduled",
    "source": "attached-school-calendar",
    "notes": ""
  },
  {
    "id": "q1-unreal-l13",
    "scheduleId": "q1-unreal-l13",
    "programAreaId": "unreal-engine",
    "quarter": "Q1",
    "lessonId": "ue-q1-l13",
    "lessonNumber": 13,
    "lessonTitle": "Quiz 3 and Lumen Lighting",
    "aDayDate": "2026-09-28",
    "bDayDate": "2026-09-25",
    "aDayCycle": "A",
    "bDayCycle": "B",
    "aDayCalendarNote": "",
    "bDayCalendarNote": "",
    "activeItemType": "lesson",
    "status": "scheduled",
    "source": "attached-school-calendar",
    "notes": ""
  },
  {
    "id": "q1-unreal-l14",
    "scheduleId": "q1-unreal-l14",
    "programAreaId": "unreal-engine",
    "quarter": "Q1",
    "lessonId": "ue-q1-l14",
    "lessonNumber": 14,
    "lessonTitle": "Light Types and Scene Lighting",
    "aDayDate": "2026-09-30",
    "bDayDate": "2026-09-29",
    "aDayCycle": "A",
    "bDayCycle": "B",
    "aDayCalendarNote": "",
    "bDayCalendarNote": "",
    "activeItemType": "lesson",
    "status": "scheduled",
    "source": "attached-school-calendar",
    "notes": ""
  },
  {
    "id": "q1-unreal-l15",
    "scheduleId": "q1-unreal-l15",
    "programAreaId": "unreal-engine",
    "quarter": "Q1",
    "lessonId": "ue-q1-l15",
    "lessonNumber": 15,
    "lessonTitle": "Landscapes",
    "aDayDate": "2026-10-02",
    "bDayDate": "2026-10-01",
    "aDayCycle": "A",
    "bDayCycle": "B",
    "aDayCalendarNote": "",
    "bDayCalendarNote": "",
    "activeItemType": "lesson",
    "status": "scheduled",
    "source": "attached-school-calendar",
    "notes": ""
  },
  {
    "id": "q1-unreal-l16",
    "scheduleId": "q1-unreal-l16",
    "programAreaId": "unreal-engine",
    "quarter": "Q1",
    "lessonId": "ue-q1-l16",
    "lessonNumber": 16,
    "lessonTitle": "Foliage, Mini-World, and Blueprint Preview",
    "aDayDate": "",
    "bDayDate": "2026-10-05",
    "aDayCycle": "A",
    "bDayCycle": "B",
    "aDayCalendarNote": "",
    "bDayCalendarNote": "",
    "activeItemType": "lesson",
    "status": "needs-teacher-review",
    "source": "attached-school-calendar",
    "notes": "Video Production begins October 6 (A). The A-day Foliage, Mini-World, and Blueprint Preview session is deferred to the next Unreal unit; its replacement date needs teacher review. B classes retain October 5.",
    "deferredCycles": [
      "A"
    ]
  },
  {
    "id": "q2-file-org-video-production",
    "scheduleId": "q2-file-org-video-production",
    "programAreaId": "video-production",
    "quarter": "Q2",
    "lessonId": "vp-q2-file-org-01",
    "lessonNumber": 1,
    "lessonTitle": "Video Production File Organization",
    "notes": "Q2 opens with production file organization before DaVinci Resolve begins. A classes see this first on 2026-10-06; B classes see it on 2026-10-07. The teacher moved the Video Production start ahead of the grading-period boundary.",
    "aDayDate": "2026-10-06",
    "bDayDate": "2026-10-07",
    "aDayCycle": "A",
    "bDayCycle": "B",
    "aDayCalendarNote": "",
    "bDayCalendarNote": "",
    "activeItemType": "lesson",
    "status": "scheduled",
    "source": "teacher-provided-block-calendar"
  },
  {
    "id": "q2-file-org-video-game-development",
    "scheduleId": "q2-file-org-video-game-development",
    "programAreaId": "unreal-engine",
    "quarter": "Q2",
    "lessonId": "ue-q2-file-org-01",
    "lessonNumber": 2,
    "lessonTitle": "Video Game Development File Organization",
    "notes": "The second Q2 opener applies the same organization habit to game development assets before DaVinci Resolve begins.",
    "aDayDate": "2026-10-08",
    "bDayDate": "2026-10-09",
    "aDayCycle": "A",
    "bDayCycle": "B",
    "aDayCalendarNote": "",
    "bDayCalendarNote": "End of 1st Grading Period (42 Days)",
    "activeItemType": "lesson",
    "status": "scheduled",
    "source": "teacher-provided-block-calendar"
  },
  {
    "id": "q2-davinci-l01",